<?xml version="1.0" encoding="utf-8"?>
<xs:schema xmlns:xs="http://www.w3.org/2001/XMLSchema">
   <xs:simpleType name="booleanText">
      <xs:restriction base="xs:string">
         <xs:enumeration value="true"/>
         <xs:enumeration value="false"/>
      </xs:restriction>
   </xs:simpleType>

   <xs:complexType name="defineType">
      <xs:attribute name="name" type="xs:string" use="required"/>
      <!--
         Missing value means a normal predefined macro (Doxygen treats this as =1).
         value="" means an explicit empty replacement. Non-empty values may contain
         spaces and function-like macro replacements.
      -->
      <xs:attribute name="value" type="xs:string" use="optional"/>
   </xs:complexType>

   <xs:complexType name="optionType">
      <xs:attribute name="name" type="xs:string" use="required"/>
      <xs:attribute name="value" type="xs:string" use="required"/>
   </xs:complexType>

   <xs:complexType name="excludeType">
      <xs:attribute name="pattern" type="xs:string" use="required"/>
   </xs:complexType>

   <!--
      Collection overrides are a negative list only. The collection members are
      still discovered exclusively from the first directory level of the
      published API tree. An override changes the effective Doxygen profile only
      when a directory with the exact module name is actually discovered.
   -->
   <xs:complexType name="collectionOverrideType">
      <xs:sequence>
         <xs:element name="define" type="defineType" minOccurs="0" maxOccurs="unbounded"/>
         <xs:element name="option" type="optionType" minOccurs="0" maxOccurs="unbounded"/>
         <xs:element name="exclude" type="excludeType" minOccurs="0" maxOccurs="unbounded"/>
      </xs:sequence>
      <xs:attribute name="module" type="xs:string" use="required"/>
   </xs:complexType>

   <xs:complexType name="libraryType">
      <xs:sequence>
         <xs:element name="define" type="defineType" minOccurs="0" maxOccurs="unbounded"/>
         <xs:element name="option" type="optionType" minOccurs="0" maxOccurs="unbounded"/>
         <xs:element name="exclude" type="excludeType" minOccurs="0" maxOccurs="unbounded"/>
         <xs:element name="override" type="collectionOverrideType" minOccurs="0" maxOccurs="unbounded"/>
      </xs:sequence>
      <xs:attribute name="id" type="xs:string" use="required"/>
      <xs:attribute name="doxygen" type="booleanText" use="optional"/>
      <xs:attribute name="latex" type="booleanText" use="optional"/>
      <xs:attribute name="source" type="booleanText" use="optional"/>
      <xs:attribute name="inlineSource" type="booleanText" use="optional"/>
      <xs:attribute name="publicOnly" type="booleanText" use="optional"/>
      <!--
         A collection is documented with one non-recursive Doxygen run for the
         common published API root and one recursive Doxygen run for every
         first-level directory below that root. The directory structure is the
         contract; no module/section list is configured here.
      -->
      <xs:attribute name="collection" type="booleanText" use="optional" default="false"/>
   </xs:complexType>

   <xs:element name="buildDocumentation">
      <xs:complexType>
         <xs:sequence>
            <xs:element name="define" type="defineType" minOccurs="0" maxOccurs="unbounded"/>
            <xs:element name="option" type="optionType" minOccurs="0" maxOccurs="unbounded"/>
            <xs:element name="exclude" type="excludeType" minOccurs="0" maxOccurs="unbounded"/>
            <xs:element name="library" type="libraryType" minOccurs="0" maxOccurs="unbounded"/>
         </xs:sequence>
         <xs:attribute name="schemaVersion" use="required" fixed="1"/>
         <xs:attribute name="doxygen" type="booleanText" use="optional" default="true"/>
         <!-- If omitted, latex inherits BuildEngine.xml/WithLatex. -->
         <xs:attribute name="latex" type="booleanText" use="optional"/>
         <xs:attribute name="source" type="booleanText" use="optional" default="false"/>
         <xs:attribute name="inlineSource" type="booleanText" use="optional" default="false"/>
         <xs:attribute name="publicOnly" type="booleanText" use="optional" default="false"/>
      </xs:complexType>
   </xs:element>
</xs:schema>