<?xml version="1.0" encoding="utf-8"?>
<buildDocumentation xmlns:xsi="http://www.w3.org/2001/XMLSchema-instance"
                    xsi:noNamespaceSchemaLocation="schemas/build-documentation.xsd"
                    schemaVersion="1"
                    doxygen="true"
                    latex="false"
                    source="false"
                    inlineSource="false"
                    publicOnly="false">
   <!--
      Central documentation policy for every library in the sibling
      build-libraries.xml contract.

      A library does not need an entry here to be documented. The root profile
      is inherited by every library. <library> nodes are overrides only.

      Collection members are never listed here. A collection is discovered from
      the first directory level of its published API tree. <override module="...">
      is a negative list: it exists only for a discovered member that needs
      additional Doxygen definitions, options or exclusions.

      For <define>, an omitted value means a normal predefined macro (Doxygen
      treats this as =1). value="" means an explicit empty replacement.
      Function-like macro names and replacement text containing spaces are
      supported and are quoted when the generated Doxyfile is written.

      <option> writes a Doxygen configuration value after the generated base
      profile and therefore deliberately overrides the generic defaults.

      These definitions affect Doxygen preprocessing only. They never change
      the compiler, target ABI or library build contract.
   -->

   <option name="USE_MATHJAX" value="YES"/>
   <option name="MATHJAX_VERSION" value="MathJax_3"/>
   <option name="MATHJAX_FORMAT" value="SVG"/>
   <option name="MATHJAX_RELPATH" value="/js/mathjax/es5"/>

   <library id="boost" publicOnly="true" collection="true">
      <!-- Common BCC64X documentation model: Clang 20 / C++23. -->
      <define name="__clang__" value="1"/>
      <define name="__clang_major__" value="20"/>
      <define name="__clang_minor__" value="1"/>
      <define name="__cplusplus" value="202302L"/>

      <!-- Common Boost macro simplifications used across several libraries. -->
      <define name="BOOST_FORCEINLINE" value="inline"/>
      <define name="BOOST_SYMBOL_VISIBLE" value=""/>
      <define name="BOOST_ATTRIBUTE_NODISCARD" value="[[nodiscard]]"/>
      <define name="BOOST_INLINE_VARIABLE" value="inline"/>
      <define name="BOOST_CONSTEXPR" value="constexpr"/>
      <define name="BOOST_CXX14_CONSTEXPR" value="constexpr"/>
      <define name="BOOST_CONSTEXPR_OR_CONST" value="constexpr"/>
      <define name="BOOST_INLINE_CONSTEXPR" value="inline constexpr"/>
      <define name="BOOST_STATIC_CONSTEXPR" value="static constexpr"/>
      <define name="BOOST_NOEXCEPT" value="noexcept"/>
      <define name="BOOST_NOEXCEPT_IF(T)" value="noexcept(T)"/>
      <define name="BOOST_NOEXCEPT_OR_NOTHROW" value="noexcept"/>
      <define name="BOOST_RV_REF(T)" value="T&amp;&amp;"/>
      <define name="BOOST_FWD_REF(T)" value="T&amp;&amp;"/>
      <define name="BOOST_COPY_ASSIGN_REF(T)" value="T const&amp;"/>
      <define name="BOOST_NESTED_TEMPLATE" value="template"/>
      <define name="BOOST_STATIC_ASSERT(x)" value=""/>
      <define name="BOOST_STATIC_ASSERT_MSG(x,y)" value=""/>
      <define name="BOOST_STATIC_CONSTANT(x,y)" value="static constexpr x y"/>
      <define name="BOOST_DEFAULTED_FUNCTION(x,y)" value="x = default;"/>
      <define name="BOOST_DELETED_FUNCTION(x)" value="x = delete;"/>
      <define name="BOOST_EXPLICIT_OPERATOR_BOOL()" value="explicit operator bool() const;"/>
      <define name="BOOST_EXPLICIT_OPERATOR_BOOL_NOEXCEPT()" value="explicit operator bool() const noexcept;"/>
      <define name="BOOST_CONSTEXPR_EXPLICIT_OPERATOR_BOOL()" value="explicit constexpr operator bool() const noexcept;"/>

      <option name="SKIP_FUNCTION_MACROS" value="NO"/>
      <option name="SEARCH_INCLUDES" value="NO"/>
      <option name="HIDE_FRIEND_COMPOUNDS" value="YES"/>
      <option name="SHOW_INCLUDE_FILES" value="NO"/>
      <option name="INLINE_INFO" value="NO"/>
      <option name="SORT_MEMBER_DOCS" value="NO"/>
      <option name="SHOW_USED_FILES" value="NO"/>
      <option name="DISTRIBUTE_GROUP_DOC" value="YES"/>
      <option name="CASE_SENSE_NAMES" value="YES"/>

      <!-- Generic non-API material. publicOnly adds detail/impl/preprocessed/aux_/cpp03. -->
      <exclude pattern="*/test/*"/>
      <exclude pattern="*/tests/*"/>
      <exclude pattern="*/example/*"/>
      <exclude pattern="*/examples/*"/>
      <exclude pattern="*/bench/*"/>
      <exclude pattern="*/benchmark/*"/>
      <exclude pattern="*/performance/*"/>
      <exclude pattern="*/performance_tests/*"/>
      <exclude pattern="*/libs/*/test/*"/>
      <exclude pattern="*/libs/*/tests/*"/>
      <exclude pattern="*/libs/*/example/*"/>
      <exclude pattern="*/libs/*/examples/*"/>
      <exclude pattern="*/libs/*/bench/*"/>
      <exclude pattern="*/libs/*/benchmark/*"/>
      <exclude pattern="*/libs/*/doc/example/*"/>
      <exclude pattern="*/tools/*"/>

      <override module="algorithm"><define name="BOOST_ALGORITHM_DOXYGEN" value="1"/></override>
      <override module="asio">
         <define name="GENERATING_DOCUMENTATION"/>
         <define name="BOOST_ASIO_INITFN_RESULT_TYPE(t,a)" value="auto"/>
         <define name="BOOST_ASIO_INITFN_AUTO_RESULT_TYPE(t,a)" value="__deduced__"/>
         <define name="BOOST_ASIO_COMPLETION_TOKEN_FOR(sig)" value="class"/>
         <define name="BOOST_ASIO_DEFAULT_COMPLETION_TOKEN_TYPE(ex)" value=""/>
         <define name="BOOST_ASIO_DEFAULT_COMPLETION_TOKEN(ex)" value=" =__deduced__"/>
      </override>
      <override module="beast">
         <define name="BOOST_BEAST_DOXYGEN"/>
         <define name="BOOST_BEAST_USE_POSIX_FILE" value="1"/>
         <define name="BOOST_BEAST_USE_WIN32_FILE" value="1"/>
         <define name="BOOST_BEAST_SPLIT_COMPILATION" value="1"/>
         <define name="BOOST_BEAST_DECL" value=""/>
         <define name="BOOST_BEAST_ASYNC_RESULT1(t)" value="__deduced__"/>
         <define name="BOOST_BEAST_ASYNC_RESULT2(t)" value="__deduced__"/>
         <define name="BOOST_BEAST_ASYNC_TPARAM1" value="class"/>
         <define name="BOOST_BEAST_ASYNC_TPARAM2" value="class"/>
         <define name="BOOST_ASIO_INITFN_RESULT_TYPE(t,a)" value="auto"/>
         <define name="BOOST_ASIO_INITFN_AUTO_RESULT_TYPE(t,a)" value="__deduced__"/>
         <define name="BOOST_ASIO_COMPLETION_TOKEN_FOR(sig)" value="class"/>
         <define name="BOOST_ASIO_DEFAULT_COMPLETION_TOKEN_TYPE(ex)" value=""/>
         <define name="BOOST_ASIO_DEFAULT_COMPLETION_TOKEN(ex)" value=" =__deduced__"/>
      </override>
      <override module="bimap">
         <define name="BOOST_BIMAP_DOXYGEN_WILL_NOT_PROCESS_THE_FOLLOWING_LINES"/>
         <define name="BOOST_BIMAP_ONLY_DOXYGEN_WILL_PROCESS_THE_FOLLOWING_LINES"/>
      </override>
      <override module="compute"><define name="BOOST_COMPUTE_DOXYGEN_INVOKED"/></override>
      <override module="container">
         <define name="BOOST_CONTAINER_DOXYGEN_INVOKED"/>
         <define name="insert_const_ref_type" value=" const T&amp;"/>
         <define name="BOOST_CONTAINER_IMPDEF(T)" value="implementation_defined"/>
         <define name="BOOST_CONTAINER_SEEDOC(T)" value="see_documentation"/>
         <define name="BOOST_RV_REF_BEG" value=""/>
         <define name="BOOST_RV_REF_END" value="&amp;&amp;"/>
         <define name="BOOST_RV_REF_BEG_IF_CXX11" value=""/>
         <define name="BOOST_RV_REF_END_IF_CXX11" value="&amp;&amp;"/>
         <define name="BOOST_CONTAINER_NODISCARD" value="[[nodiscard]] "/>
         <define name="BOOST_NORETURN" value="[[noreturn]] "/>
         <define name="BOOST_INTRUSIVE_OPTION_CONSTANT(OPTION_NAME, TYPE, VALUE, CONSTANT_NAME)" value="template&lt;TYPE VALUE&gt; struct OPTION_NAME{};"/>
         <define name="BOOST_INTRUSIVE_OPTION_TYPE(OPTION_NAME, TYPE, TYPEDEF_EXPR, TYPEDEF_NAME)" value="template&lt;class TYPE&gt; struct OPTION_NAME{};"/>
         <define name="BOOST_CONTAINER_DOC1ST(T1,T2)" value="T1"/>
         <define name="BOOST_CONTAINER_DOCIGN(T)" value=""/>
         <define name="BOOST_CONTAINER_DOCONLY(T)" value="T"/>
         <define name="BOOST_CONTAINER_SCOPEDALLOC_DUMMYTRUE" value=""/>
         <define name="BOOST_CONTAINER_SCOPEDALLOC_ALLINNER" value="InnerAllocs..."/>
         <define name="BOOST_CONTAINER_SCOPEDALLOC_ALLINNERCLASS" value="typename... InnerAllocs"/>
         <define name="BOOST_CONTAINER_DECL" value=""/>
         <define name="BOOST_CONTAINER_CONSTANT_VAR" value="static constexpr "/>
         <define name="BOOST_CONTAINER_FORCEINLINE" value="inline"/>
      </override>
      <override module="fusion">
         <define name="BOOST_FUSION_HAS_VARIADIC_DEQUE" value="1"/>
         <define name="BOOST_FUSION_HAS_VARIADIC_VECTOR" value="1"/>
         <define name="BOOST_FUSION_HAS_VARIADIC_LIST" value="1"/>
         <define name="BOOST_FUSION_HAS_VARIADIC_MAP" value="1"/>
         <define name="BOOST_FUSION_HAS_VARIADIC_SET" value="1"/>
         <define name="BOOST_FUSION_HAS_VARIADIC_TUPLE" value="1"/>
      </override>
      <override module="geometry">
         <define name="BOOST_CONCEPT_REQUIRES(x)" value=""/>
         <define name="BOOST_CONCEPT_ASSERT(x)" value=""/>
         <define name="DOXYGEN_SHOULD_SKIP_THIS"/>
         <define name="DOXYGEN_NO_DISPATCH"/>
         <define name="DOXYGEN_NO_IMPL"/>
         <define name="DOXYGEN_NO_DETAIL"/>
         <define name="DOXYGEN_NO_CONCEPT_MEMBERS"/>
         <define name="DOXYGEN_NO_TRAITS_SPECIALIZATIONS"/>
         <define name="DOXYGEN_NO_STRATEGY_SPECIALIZATIONS"/>
         <define name="DOXYGEN_NO_SPECIALIZATIONS"/>
         <define name="DOXYGEN_INVOKED"/>
      </override>
      <override module="hana"><define name="BOOST_HANA_DOXYGEN_INVOKED"/></override>
      <override module="histogram"><define name="BOOST_HISTOGRAM_DOXYGEN_INVOKED"/></override>